mlang_other,demographics_core,,text,"(If Other) Specify the participant's biological mother's native language:",,,,,,,[mlang]=777,y,,,,," @ONTOLOGY='NCIT:C16779'"
methnicity,demographics_core,,dropdown,"What is the participant's biological mother's ethnic or tribal affiliation?","1, Acholi | 2, Afar | 3, Afrikaner | 4, Agaw | 5, Aka | 6, Akan | 7, Aku | 8, Alur | 9, Ameru | 10, Amhara | 11, Anuak | 12, Baka | 13, Bambara | 14, Banda | 15, Banyoro | 16, Basaa | 17, Beja | 18, Bemba | 19, Berber | 20, BetiPahuin | 21, Biafada | 22, Bilen | 23, Cape Coloured | 24, Chagga | 25, Chewa | 26, Chinese | 27, Chokwe | 28, Copt | 29, Dendi | 30, Dinka | 31, Edo | 32, English | 33, Efik | 34, Egyptian | 35, Eket | 36, Esan | 37, Ewe | 38, Fon | 39, Fulani | 40, Fur | 41, Ga | 42, Ganda | 43, Gbaya | 44, Goffal | 45, Gurage | 46, Gwari | 47, Hausa | 48, Herero | 49, Himba | 50, Hutu | 51, Igbo | 52, Ijaw | 53, Indian | 54, Italian | 55, Jola | 56, Kalanga | 57, Kalenjin | 58, Kamba | 59, Kanuri | 60, Khoikhoi | 61, Kikuyu | 62, Kongo | 63, Kotoko | 64, Kwama | 65, Langi | 66, Lemba | 67, Lingala | 68, Luba | 69, Lugbara | 70, Luhya | 71, Luo | 72, Maasai | 73, Maghrebi | 74, Makonde | 75, Makua | 76, Mande South | 77, Mandingo | 78, Marka | 79, Mbunda | 80, Mbundu | 81, Mende | 82, Moghamo | 83, Mole-Dagbani | 84, Mongo | 85, Nambya | 86, Ngamambo | 87, North Ndebele | 88, Nubian | 89, Nuer | 90, Oromo | 91, Ovambo | 92, Ovimbundu | 93, Papel | 94, Portuguese | 95, Saho | 96, Samburu | 97, San | 98, Sara | 99, Serer | 100, Shilluk | 101, Shona | 102, Sidama | 103, Somali | 104, Songhai | 105, Sotho | 106, South Ndebele | 107, Spanish | 108, Sua | 109, Swahili | 110, Swazi | 111, Tigray-Tigrinya | 112, Tigre | 113, Tiv | 114, Tonga | 115, Toubou | 116, Tsonga | 117, Tswana | 118, Tuareg | 119, Tutsi | 120, Twa | 121, Urhobo | 122, Venda | 123, Wolof | 124, Xhosa | 125, Yeyi | 126, Yoruba | 127, Zaghawa | 128, Zande | 129, Zarma | 130, Zulu | 777, Other",,,,,,,y,,,,," @ONTOLOGY='EFO:0001799'"
methnicity_other,demographics_core,,text,"(If Other) Specify the participant's biological mother's ethnic or tribal affiliation:",,,,,,,[methnicity]=777,y,,,,," @ONTOLOGY='EFO:0001799'"
school_current,demographics_core,,radio,"Is the participant currently attending school?","1, Yes | 0, No",,,,,,,y,,,,," @ONTOLOGY='NCIT:C147485'"
schooltype,demographics_core,,radio,"(If Yes) What type of school?","1, Early Learning Centre / Nursery / Creche | 2, Preschool / Kindergarten / Grade R | 3, Public Primary school (Grade 1 - 7) | 4, Private Primary school (Grade 1 - 7) | 5, Public Secondary school (Grade 8 - 12) | 6, Private Secondary school (Grade 8 - 12) | 7, Special school / School for children with disabilities | 8, Homeschool / Cottage school | 9, Tertiary school / College / Technikon /University",,,,,,[school_current]='1',y,,,,," @ONTOLOGY='GECKO:0000065'"
highest_education,demographics_core,,radio,"(If No) What is the highest level of education achieved by the participant?","0, No formal education | 1, Primary | 2, Secondary | 3, Tertiary",,,,,,[school_current]='0',y,,,,," @ONTOLOGY='OMRSE:00002045'"
caregiver_education,demographics_core,,radio,"What is the highest level of education achieved by the participant's primary caregiver?","0, No formal education | 1, Primary | 2, Secondary | 3, Tertiary",,,,,,[agecalc]<19,y,,,,," @ONTOLOGY='OMRSE:00002045'"
caregiver_employ,demographics_core,,radio,"What is the employment status of the participant's primary caregiver?","1, Self employed | 2, Formal full-time employment by someone else | 3, Part-time employment by someone else | 4, Informal employment (dependent on availability of work) | 0, Unemployed",,,,,,[agecalc]<19,,,,,," @ONTOLOGY='EFO:0005241'"
demo_version,demographics_core,,descriptive,"Demographics - Core Instrument Version 2.0 Released September 2022
H3ABioNet & H3Africa Phenotype Standards",,,,,,,,,,,,,
anthro_collectdate,anthropometrics_core,,text,"Collection date of anthropometrics measures:",,DD-MM-YYYY,date_dmy,,,,,y,,,,," @ONTOLOGY='NCIT:C81286'"
head_circ_1,anthropometrics_core,"<p style=""text-align: left; font-size: 14pt;font-style: Calibri;""><strong>HEAD CIRCUMFERENCE</strong></p>",text,"Head circumference measurement #1:",,"Please provide head measurement in centimetres.",,,,,[agecalc]<12,y,,,,," @ONTOLOGY='EFO:0005114'"
head_circ_2,anthropometrics_core,,text,"Head circumference measurement #2:",,"Please provide head measurement in centimetres.",,,,,[agecalc]<12,y,,,,," @ONTOLOGY='EFO:0005114'"
head_circ_3,anthropometrics_core,,text,"Head circumference measurement #3:",,"Please provide head measurement in centimetres.",,,,,[agecalc]<12,y,,,,," @ONTOLOGY='EFO:0005114'"
head_circ_avg,anthropometrics_core,,calc,"Calculated average head circumference (cm):","if ([head_circ_1]<>"""" and [head_circ_2]<>"""" and [head_circ_3]<>"""",sum([head_circ_1],[head_circ_2],[head_circ_3])/3, if([head_circ_1]<>"""" and [head_circ_2]<>"""" and [head_circ_3]="""", sum([head_circ_1],[head_circ_2])/2, if([head_circ_1]<>"""" and [head_circ_2]="""" and [head_circ_3]="""", [head_circ_1],"""")))","This field is automatically calculated.",,,,,[agecalc]<12,,,,,," @HIDDEN @READONLY
@ONTOLOGY='EFO:0005114'"
height_1,anthropometrics_core,"<p style=""text-align: left; font-size: 14pt;font-style: Calibri;""><strong>HEIGHT</strong> </p>",text,"Height measurement #1:",,"Provide measurement in centimetres.",integer,10,250,,,y,,,,," @ONTOLOGY='EFO:0004339'"
height_2,anthropometrics_core,,text,"Height measurement #2:",,"Provide measurement in centimetres.",integer,10,250,,,y,,,,," @ONTOLOGY='EFO:0004339'"
height_3,anthropometrics_core,,text,"Height measurement #3:",,"Provide measurement in centimetres.",integer,10,250,,,y,,,,," @ONTOLOGY='EFO:0004339'"
height_avg,anthropometrics_core,,calc,"Calculated average height (cm):","if ([height_1]<>"""" and [height_2]<>"""" and [height_3]<>"""",sum([height_1],[height_2],[height_3])/3, if([height_1]<>"""" and [height_2]<>"""" and [height_3]="""", sum([height_1],[height_2])/2, if([height_1]<>"""" and [height_2]="""" and [height_3]="""", [height_1],"""")))","This field is automatically calculated.",,,,,,,,,,," @READONLY @HIDDEN
@ONTOLOGY='EFO:0004339'"
height_self,anthropometrics_core,,text,"Approximate height reported by participant:
<i>(Only if measuring height is not possible)</i>",,"Provide measurement in centimetres.",integer,20,250,,,,,,,," @ONTOLOGY='EFO:0004339'"
weight_1,anthropometrics_core,"<p style=""text-align: left; font-size: 14pt;font-style: Calibri;""><strong>WEIGHT </strong></p>",text,"Weight measurement #1:",,"Provide weight measurement in kilograms.",number,0.2,300,,,y,,,,," @ONTOLOGY='EFO:0004338'"
weight_2,anthropometrics_core,,text,"Weight measurement #2:",,"Provide weight measurement in kilograms.",number,0.2,300,,,y,,,,," @ONTOLOGY='EFO:0004338'"
weight_3,anthropometrics_core,,text,"Weight measurement #3:",,"Provide weight measurement in kilograms.",number,0.2,300,,,y,,,,," @ONTOLOGY='EFO:0004338'"
weight_avg,anthropometrics_core,,calc,"Calculated average weight (kg):","if ([weight_1]<>"""" and [weight_2]<>"""" and [weight_3]<>"""",sum([weight_1],[weight_2],[weight_3])/3, if([weight_1]<>"""" and [weight_2]<>"""" and [weight_3]="""", sum([weight_1],[weight_2])/2, if([weight_1]<>"""" and [weight_2]="""" and [weight_3]="""", [weight_1],"""")))","This field is automatically calculated.",,,,,,y,,,,," @READONLY @HIDDEN 
@ONTOLOGY='EFO_0004338'"
medpros,anthropometrics_core,,radio,"Is the participant wearing a cast or medical prosthesis? ","1, Yes | 0, No",,,,,,,y,,,,," @ONTOLOGY='NCIT:C17598'"
proslocation,anthropometrics_core,,text,"Location of cast or medical prosthesis: ",,,,,,,[medpros]=1,y,,,,," @ONTOLOGY='NCIT:C17598'"
weightclothed,anthropometrics_core,,radio,"Is the participant wearing street clothes during the weight measurements? ","1, Yes | 0, No",,,,,,,y,,,,,
weight_self,anthropometrics_core,,text,"Approximate weight reported by the participant:
<i>(Only if measuring weight is not possible)</i>",,"Provide weight measurement in kilograms.",number,0.2,350,,,,,,,," @ONTOLOGY='EFO_0004338'"
arm_circ_1,anthropometrics_core,"<p style=""text-align: left; font-size: 14pt;font-style: Calibri;""><strong>MID-UPPER ARM CIRCUMFERENCE</strong></p>",text,"Mid-upper arm circumference measurement #1:
",,"Provide mid-upper arm measurement in centimetres.",integer,,,,,y,,,,," @ONTOLOGY='NCIT:C124475'"
arm_circ_2,anthropometrics_core,,text,"Mid-upper arm circumference measurement #2:
",,"Provide mid-upper arm measurement in centimetres.",integer,,,,,y,,,,," @ONTOLOGY='NCIT:C124475'"
arm_circ_3,anthropometrics_core,,text,"Mid-upper arm circumference measurement #3:
",,"Provide mid-upper arm measurement in centimetres.",integer,,,,,y,,,,," @ONTOLOGY='NCIT:C124475'"
arm_circ_avg,anthropometrics_core,,calc,"Calculated average mid-upper arm circumference (cm):","if ([arm_circ_1]<>"""" and [arm_circ_2]<>"""" and [arm_circ_3]<>"""",sum([arm_circ_1],[arm_circ_2],[arm_circ_3])/3, if([arm_circ_1]<>"""" and [arm_circ_2]<>"""" and [arm_circ_3]="""", sum([arm_circ_1],[arm_circ_2])/2, if([arm_circ_1]<>"""" and [arm_circ_2]="""" and [arm_circ_3]="""", [arm_circ_1],"""")))","This field is automatically calculated.",,,,,,y,,,,," @READONLY @HIDDEN 
@ONTOLOGY='NCIT:C124475'"
hip_circ_1,anthropometrics_core,"<p style=""text-align: left; font-size: 14pt;font-style: Calibri;""><strong>HIP CIRCUMFERENCE </strong></p>",text,"Hip circumference measurement #1:
",,"Provide hip circumference measurement in centimetres.",integer,,,,,y,,,,," @ONTOLOGY='EFO:0005093'"
hip_circ_2,anthropometrics_core,,text,"Hip circumference measurement #2:
",,"Provide hip circumference measurement in centimetres.",integer,,,,,y,,,,," @ONTOLOGY='EFO:0005093'"
hip_circ_3,anthropometrics_core,,text,"Hip circumference measurement #3:
",,"Provide hip circumference measurement in centimetres.",integer,,,,,y,,,,," @ONTOLOGY='EFO:0005093'"
hip_circ_avg,anthropometrics_core,,calc,"Calculated average hip circumference (cm):","if ([hip_circ_1]<>"""" and [hip_circ_2]<>"""" and [hip_circ_3]<>"""",sum([hip_circ_1],[hip_circ_2],[hip_circ_3])/3, if([hip_circ_1]<>"""" and [hip_circ_2]<>"""" and [hip_circ_3]="""", sum([hip_circ_1],[hip_circ_2])/2, if([hip_circ_1]<>"""" and [hip_circ_2]="""" and [hip_circ_3]="""", [hip_circ_1],"""")))","This field is automatically calculated.",,,,,,y,,,,," @READONLY @HIDDEN 
@ONTOLOGY='EFO:0005093'"
waist_circ_1,anthropometrics_core,"<p style=""text-align: left; font-size: 14pt;font-style: Calibri;""><strong>WAIST CIRCUMFERENCE</strong></p>",text,"Waist circumference measurement #1:",,"Please provide waist measurement in centimetres.",,,,,,y,,,,," @ONTOLOGY='EFO:0004342'"
waist_circ_2,anthropometrics_core,,text,"Waist circumference measurement #2:",,"Please provide waist measurement in centimetres.",,,,,,y,,,,," @ONTOLOGY='EFO:0004342'"
waist_circ_3,anthropometrics_core,,text,"Waist circumference measurement #3:",,"Please provide waist measurement in centimetres.",,,,,,y,,,,," @ONTOLOGY='EFO:0004342'"
waist_circ_avg,anthropometrics_core,,calc,"Calculated average waist circumference (cm):","if ([waist_circ_1]<>"""" and [waist_circ_2]<>"""" and [waist_circ_3]<>"""",sum([waist_circ_1],[waist_circ_2],[waist_circ_3])/3, if([waist_circ_1]<>"""" and [waist_circ_2]<>"""" and [waist_circ_3]="""", sum([waist_circ_1],[waist_circ_2])/2, if([waist_circ_1]<>"""" and [waist_circ_2]="""" and [waist_circ_3]="""", [waist_circ_1],"""")))","This field is automatically calculated.",,,,,,,,,,," @HIDDEN @READONLY
@ONTOLOGY='EFO:0004342'"
anthropometrics_version,anthropometrics_core,,descriptive,"Anthropometrics - Core Instrument Version 2.0 Released September 2022
H3ABioNet & H3Africa Phenotype Standards",,,,,,,,,,,,,
hypertens_collectdate,hypertension_history_core,,text,"Collection date of hypertension information:",,DD-MM-YYYY,date_dmy,,,,,y,,,,," @ONTOLOGY='NCIT:C81286'"
hypertens,hypertension_history_core,"<p style=""text-align: left; font-size: 14pt;font-style: Calibri;""><strong>HYPERTENSION HISTORY</strong></p>",radio,"Has a healthcare worker ever said the participant has high blood pressure or hypertension? ","1, Yes | 0, No",,,,,,,y,,,,," @ONTOLOGY='HP:0000822'"
hypertens_age,hypertension_history_core,,text,"(If Yes) At what age was the participant first told this? ",,"Provide age in years.",integer,1,100,,"[hypertens] = ""1""",y,,,,," @ONTOLOGY='EFO:0004918'"
gesthypertens,hypertension_history_core,,radio,"(<u>FOR</u> Women): Was this during pregnancy only?","1, Yes | 0, No",,,,,,"[hypertens] = ""1"" and [sex]=2",y,,,,," @ONTOLOGY='NCIT:C4371'"
bpmeds,hypertension_history_core,,radio,"Has the participant ever taken medication for hypertension/high blood pressure?","1, Yes now | 2, Yes not now | 0, No",,,,,,"[hypertens] = ""1""",y,,,,,
bpmedstart,hypertension_history_core,,text,"(If Yes) At what age did they begin taking medicine for hypertension/high blood pressure? ",,"Provide age in years.",integer,1,100,,"[bpmeds] = 1 or [bpmeds] = 2",y,,,,," @ONTOLOGY='SCDO:0000740'"
hypertens_version,hypertension_history_core,,descriptive,"Hypertension History - Core Instrument Version 2.0 Released September 2022
H3ABioNet & H3Africa Phenotype Standards",,,,,,,,,,,,,
bp_collectdate,blood_pressure_core,,text,"Date of blood pressure measurements:",,DD-MM-YYYY,date_dmy,,,,,y,,,,," @ONTOLOGY='NCIT:C81286'"
bpdevice,blood_pressure_core,"<p style=""text-align: left; font-size: 14pt;font-style: Calibri;""><strong>BLOOD PRESSURE MEASUREMENTS</strong></p>",text,"For blood pressure measurements, specify Aneroid sphygmomanometers name and model:",,,,,,,,y,,,,," @ONTOLOGY='ERO:0000838'"
bpdevice_size,blood_pressure_core,,radio,"Blood pressure cuffs size used (S, M, L, XL):","0, S | 1, M | 2, L | 3, XL",,,,,,,y,RH,,,," @ONTOLOGY='SNOMED722471002'"
bp_systolic1,blood_pressure_core,,text,"Systolic Pressure measurement #1:",,mmHg,number,,,,,y,,,,," @ONTOLOGY='CMO:0000003'"
bp_diastolic1,blood_pressure_core,,text,"Diastolic Pressure measurement #1:",,mmHg,number,,,,,y,,,,," @ONTOLOGY='CMO:0000003'"
bp_systolic2,blood_pressure_core,,text,"Systolic Pressure measurement #2:",,mmHg,number,,,,,y,,,,," @ONTOLOGY='CMO:0000003'"
bp_diastolic2,blood_pressure_core,,text,"Diastolic Pressure measurement #2:",,mmHg,number,,,,,y,,,,," @ONTOLOGY='CMO:0000003'"
bp_systolic3,blood_pressure_core,,text,"Systolic Pressure measurement #3:",,mmHg,number,,,,,y,,,,," @ONTOLOGY='CMO:0000003'"
bp_diastolic3,blood_pressure_core,,text,"Diastolic Pressure measurement #3:",,mmHg,number,,,,,y,,,,," @ONTOLOGY='CMO:0000003'"
bp_systolic_avg,blood_pressure_core,,calc,"Average (calculated) systolic blood pressure measurement:","sum([bp_systolic1],[bp_systolic2],[bp_systolic3])/3","This field is automatically calculated.",,,,,,,,,,," @HIDDEN @READONLY
@ONTOLOGY='CMO:0000003'"
bp_diastolic_avg,blood_pressure_core,,calc,"Average (calculated) diastolic blood pressure measurement:","sum([bp_diastolic1],[bp_diastolic2],[bp_diastolic3])/3","This field is automatically calculated.",,,,,,,,,,," @HIDDEN @READONLY
@ONTOLOGY='CMO:0000003'"
bp_core_version,blood_pressure_core,,descriptive,"Blood Pressure - Core Instrument Version 2.0 Released September 2022
H3ABioNet & H3Africa Phenotype Standards",,,,,,,,,,,,,
urine_collectdate,urine_results,,text,"Urine sample collection date:",,DD-MM-YYYY,date_dmy,,,,,y,,,,," @ONTOLOGY='NCIT:C81286'"
urine_albumin,urine_results,,text,"Urinary albumin ",,mg/L,number,,,,,y,,,,," @ONTOLOGY='SCDO:0001209'"
urine_creatinine,urine_results,,text,"Urinary creatinine",,mg/L,number,,,,,y,,,,," @ONTOLOGY='SCDO:0001213'"
urine_protein,urine_results,,text,"Urinary total protein",,mg/L,number,,,,,y,,,,," @ONTOLOGY='NCIT:C74760'"
urine_results_version,urine_results,,descriptive,"Urine Results - Core Instrument Version 2.0 Released September 2022
H3ABioNet & H3Africa Phenotype Standards",,,,,,,,,,,,,
smokexp_collectdate,smoking_exposure_core,,text,"Collection date of smoking exposure information:",,DD-MM-YYYY,date_dmy,,,,[agecalc]<19,y,,,,," @ONTOLOGY='NCIT:C81286'"
hhsmokers,smoking_exposure_core,"<p style=""text-align: left; font-size: 14pt;font-style: Calibri;""><strong>SMOKING EXPOSURE</strong></p>",yesno,"Does anyone in the participant's household smoke cigarettes or other tobacco-based products?",,,,,,,[agecalc]<19,y,,,,," @ONTOLOGY='NCIT:C156838'"
numsmokers,smoking_exposure_core,,text,"(If Yes) How many members in the household smoke?",,,integer,,,,"[agecalc]<19 and [hhsmokers] = '1'",y,,,,," @ONTOLOGY='NCIT:C156838'"
freq_hhsmoke,smoking_exposure_core,,radio,"(If Yes) How frequently do they smoke?","1, Once, daily | 2, More than once, daily | 3, Weekly | 4, Infrequently",,,,,,"[agecalc]<19 and [hhsmokers] = '1'",y,,,,," @ONTOLOGY='NCIT:C156838'"
smoking_exposure_version,smoking_exposure_core,,descriptive,"Smoking Exposure - Core Instrument Version 2.0 Released September 2022
H3ABioNet & H3Africa Phenotype Standards",,,,,,,,,,,,,
smoke_collectdate,smoking_status_core,,text,"Collection date of smoking status information:",,DD-MM-YYYY,date_dmy,,,,[agecalc]>=12,y,,,,," @ONTOLOGY='NCIT:C81286'"
smoked100,smoking_status_core,"<p style=""text-align: left; font-size: 14pt;font-style: Calibri;""><strong>SMOKING STATUS</strong></p>",yesno,"Has the participant smoked at least 100 tobacco cigarettes in his/her entire life?",,,,,,,[agecalc]>18,y,,,,,
smoked1,smoking_status_core,,yesno,"Has the participant used at least 1 tobacco cigarette in his/her entire life (including cigarette, e-cigarette, vape, cigar etc.)?",,,,,,,"[agecalc]<19 and [agecalc]>=12",,,,,,
smoking_onset,smoking_status_core,,text,"How old was the participant when he/she first started smoking tobacco cigarettes?",,"Provide age in years.",integer,5,100,,"[smoked100]= 1 or [smoked1] = 1",y,,,,,
smoking_status,smoking_status_core,,radio,"What type of smoker would you currently say you are:","1, An EVERY day smoker | 2, A FAIRLY REGULAR (some days) smoker | 3, A FORMER smoker | -992, Don't Know | -995, Refused",,,,,,"[smoked100]= 1 or [smoked1] = 1",y,,,,," @ONTOLOGY='EFO:0006527'"
smoking_daily6m,smoking_status_core,,yesno,"Has the participant EVER smoked tobacco cigarettes EVERY DAY for at least 6 months? ",,,,,,,"[smoked100]= 1 or [smoked1] = 1",y,,,,,
smokes_per_day,smoking_status_core,,text,"On the days that you smoke, on average, how many tobacco cigarettes does the participant smoke?
<bold><u><i>OR</bold></u></i>
If you are a former smoker, on the days that you smoked, on average, how many tobacco cigarettes did you smoke?",,"Provide average number of cigarettes per day",integer,1,50,,"[smoked100]= 1 or [smoked1] = 1",y,,,,,
smoke_days_1m,smoking_status_core,,text,"Over the past 30 days, on how many <u>days</u> did you smoke?
<bold><u><i>OR</bold></u></i>
If you are a former smoker, on average, on how many <u>days</u> did you smoke in a month?",,"<strong>Every</strong> day smokers or former <strong>every</strong> day smokers should complete with '30'.",integer,0,30,,"[smoked100]= 1 or [smoked1] = 1",y,,,,,
quitsmoking,smoking_status_core,,text,"(<u>FOR</u> Former Smokers): About how long has it been since you COMPLETELY quit smoking tobacco cigarettes?",,,integer,,,,"[smoking_status] = 3",y,,,,,
quitsmokingunits,smoking_status_core,,radio,"Length of time since quitting measured in:","1, Years | 2, Months | 3, Weeks | 4, Days",,,,,,"[smoking_status] = 3",y,,,,," @ONTOLOGY='NCIT:C42574'"
cigars,smoking_status_core,"<p style=""text-align: left; font-size: 14pt;font-style: Calibri;""><strong>TOBACCO (NON-CIGARETTE) - PRODUCT USE</strong></p>
In his/her lifetime, has the participant ....",radio,"Smoked at least 50 cigars?","1, Yes | 0, No",,,,,,[agecalc]>18,y,,,tobacco_use,,
pipe,smoking_status_core,,radio,"Smoked a pipe at least 50 times?","1, Yes | 0, No",,,,,,[agecalc]>18,y,,,tobacco_use,,
vape,smoking_status_core,,radio,"Used an e-cigarette or vape at least 50 times?","1, Yes | 0, No",,,,,,[agecalc]>18,y,,,tobacco_use,,
snuff,smoking_status_core,,radio,"Used snuff, (such as Skoal, Skoal Bandit or Copenhagen) at least 20 times?","1, Yes | 0, No",,,,,,[agecalc]>18,y,,,tobacco_use,,
chewtobac,smoking_status_core,,radio,"Used chewing tobacco (such as Redman, Levi Garrett or Beechnut) at least 20 times?","1, Yes | 0, No",,,,,,[agecalc]>18,y,,,tobacco_use,,
smoking_status_version,smoking_status_core,,descriptive,"Smoking Status - Core Instrument Version 2.0 Released September 2022
H3ABioNet & H3Africa Phenotype Standards",,,,,,,,,,,,,
alcexp_collectdate,alcohol_exposure_core,,text,"Collection date of alcohol exposure information:",,DD-MM-YYYY,date_dmy,,,,[agecalc]<19,y,,,,," @ONTOLOGY='NCIT:C81286'"
hhdrink,alcohol_exposure_core,"<p style=""text-align: left; font-size: 14pt;font-style: Calibri;""><strong>ALCOHOL EXPOSURE</strong></p>",yesno,"Does anyone in the participant's household drink alcohol?",,,,,,,[agecalc]<19,y,,,,," @ONTOLOGY='EFO:0009113'"
numhhdrink,alcohol_exposure_core,,text,"(If Yes) How many members in the household drink alcohol?",,,integer,,,,"[agecalc]<19 AND [hhdrink]=""1""",y,,,,," @ONTOLOGY='EFO:0009113'"
freq_hhdrink,alcohol_exposure_core,,radio,"(If Yes) How frequently do they drink alcohol?","1, Once, daily | 2, More than once, daily | 3, Weekly | 4, Infrequently",,,,,,"[agecalc]<19 AND [hhdrink]=""1""",y,,,,," @ONTOLOGY='EFO:0009113'"
alcohol_exposure_version,alcohol_exposure_core,,descriptive,"Alcohol Exposure - Core Instrument Version 2.0 Released September 2022
H3ABioNet & H3Africa Phenotype Standards",,,,,,,,,,,,,
alcohol_collectdate,alcohol_consumption_core,,text,"Collection date for alcohol use information:",,DD-MM-YYYY,date_dmy,,,,,y,,,,," @ONTOLOGY='NCIT:C81286'"
alcohol_any,alcohol_consumption_core,"<p style=""text-align: left; font-size: 14pt;font-style: Calibri;""><strong>ALCOHOL CONSUMPTION</strong></p>",yesno,"In his/her entire life, has the participant had at least 1 drink of any kind of alcohol?
<i>(not counting small tastes or sips)</i>",,,,,,,[agecalc]>18,y,,,,," @ONTOLOGY='SCDO:0000038'"
alcohol_age,alcohol_consumption_core,,text," About how old was the participant when he/she first started drinking alcohol?
<i>(not counting small tastes or sips)</i>",,"Provide age in years.",integer,1,100,,"[agecalc]>=12 and [alcohol_any] = '1'",y,,,,," @ONTOLOGY='GECKO:0000069'"
alcohol_30days,alcohol_consumption_core,,text,"During the past 30 days, on how <u>many days</u> did the participant drink one or more drinks of an alcoholic beverage?",,"Enter ""00"" if the participant did not drink in the past 30 days.",integer,,,,"[agecalc]>=12 and [alcohol_any] = '1'",y,,,,," @ONTOLOGY='GECKO:0000069'"
alcohol_numdrinks,alcohol_consumption_core,,text,"On the days that the participant drank during the past 30 days, how <u>many drinks</u> did he/she usually have each day? 

<i>(Count as a drink a can or bottle of beer; a wine cooler or a glass of wine, champagne, or sherry; a shot of liquor or a mixed drink or cocktail.)</i>",,"Enter ""00"" if the participant did not drink in the past 30 days.",integer,,,,"[agecalc]>=12 and [alcohol_any] = '1' and [alcohol_30days]<>""00""",y,,,,," @ONTOLOGY='GECKO:0000069'"
alcohol_mostdrinks,alcohol_consumption_core,,text,"What was the LARGEST number of drinks that he/she <u>ever</u> drank in a single day?",,,integer,,,,"[agecalc]>=12 and [alcohol_any] = '1'",y,,,,," @ONTOLOGY='GECKO:0000069'"
alcohol_prefbev,alcohol_consumption_core,,radio,"What is the participant's preferred alcoholic beverage?
","1, Beer | 2, Brandy | 3, Cider | 4, Gin | 5, Rum | 6, Tequila | 7, Vodka | 8, Whiskey | 9, Wine | 777, Other",,,,,,[agecalc]>18,y,,,,," @ONTOLOGY='GECKO:0000069'"
alcohol_prefbevother,alcohol_consumption_core,,text,"(If Other) Specify preferred alcoholic beverage:
",,,,,,,"[agecalc]>18 and [alcohol_prefbev]='777'",y,,,,," @ONTOLOGY='GECKO:0000069'"
alcohol_use_version,alcohol_consumption_core,,descriptive,"Alcohol Use - Core Instrument Version 2.0 Released September 2022
H3ABioNet & H3Africa Phenotype Standards",,,,,,,,,,,,,
drug_collectdate,drug_use_core,"<p style=""text-align: left; font-size: 14pt;font-style: Calibri;""><strong>DRUG USE</strong></p>",text,"Collection date of drug use information:",,DD-MM-YYYY,date_dmy,,,,[agecalc]>=12,y,,,,," @ONTOLOGY='NCIT:C81286'"
clubdrugs,drug_use_core,"Has the participant ever used any of the following substances...",radio,"Club Drugs","1, Yes | 0, No",,,,,,[agecalc]>=12,y,,,substances,," @ONTOLOGY='NCIT:C61081'"
cocaine,drug_use_core,,radio,"Cocaine / Crack Cocaine?","1, Yes | 0, No",,,,,,[agecalc]>=12,y,,,substances,," @ONTOLOGY='NCIT:C80153'"
hallucinog,drug_use_core,,radio,Hallucinogens?,"1, Yes | 0, No",,,,,,[agecalc]>=12,y,,,substances,," @ONTOLOGY='CHEBI:35499'"
heroin,drug_use_core,,radio,Heroin?,"1, Yes | 0, No",,,,,,[agecalc]>=12,y,,,substances,," @ONTOLOGY='CHEBI:27808'"
inhalents,drug_use_core,,radio,"Inhalents / Solvents?","1, Yes | 0, No",,,,,,[agecalc]>=12,y,,,substances,," @ONTOLOGY='NCIT:C45790'"
marijuana,drug_use_core,,radio,Marijuana?,"1, Yes | 0, No",,,,,,[agecalc]>=12,y,,,substances,," @ONTOLOGY='NCIT:C26659'"
painkillers,drug_use_core,,radio,Painkillers?,"1, Yes | 0, No",,,,,,[agecalc]>=12,y,,,substances,," @ONTOLOGY='SCDO:0000050'"
sedatives,drug_use_core,,radio,"Sedatives / Tranqulizers?","1, Yes | 0, No",,,,,,[agecalc]>=12,y,,,substances,," @ONTOLOGY='SCDO:0000598'"
stimulants,drug_use_core,,radio,Stimulants?,"1, Yes | 0, No",,,,,,[agecalc]>=12,y,,,substances,," @ONTOLOGY='NCIT:C47795'"
othersubs,drug_use_core,,radio,"Any other non-prescribed substances?","1, Yes | 0, No",,,,,,[agecalc]>=12,y,,,substances,," @ONTOLOGY='NCIT:C125141'"
clubdrugs_age,drug_use_core,,text,"Club Drugs: Age of First Use?",,"Age in years.",integer,,,,"[clubdrugs] = '1'",y,,,,," @ONTOLOGY='NCIT:C61081'"
clubdrugs_days,drug_use_core,,text,"Club Drugs: Frequency Used in Past 30 Days?",,"Provide number of days used.",integer,0,30,,"[clubdrugs] = '1'",y,,,,," @ONTOLOGY='NCIT:C61081'"
